type	typeName	facet	quality_score	quality_max	quality_level	title	content
D	Decision		5	5	strong	Audit-gate migration plan published — DO + Agents SDK + Project Think as substrate target	AUDIT-GATE-RUNTIME-MIGRATION-PLAN.md merged at klappy/agent-messaging-service PR #77 (commit fd48d5df, amended dde7c50b). Five phases — persona profile authored, runtime DO scaffolded, side-by-side validation against 2-3 real PRs, cutover, cleanup. Alternatives implicit-but-not-enumerated in the plan: keep Anthropic Managed Agents (rejected: no hibernation, no trigger-surface diversity, $0.08/session-hour bundled premium with no subscription-billing path); switch to CF Sandboxes + Claude Code (rejected: one-shot dispatch shape, less natural fit for validator's fresh-context guarantee; Sandboxes spawn per-task without the DO hibernation pattern); self-hosted (rejected: operations cost dominates per substrate-options §Self-Hosted for a one-persona workload). The DO + Agents SDK + Project Think choice is a Beget-from-canon-primitives play, composing persona-shaped-runtime + substrate-options + dispatch-paths + trigger-source-taxonomy; the Bend portion is of the existing Managed-Agents path because ams://canon/constraints/canon-code-sync-via-spawned-agent-session explicitly anticipates substrate swap in its §Current Implementation section. Retraction conditions stated in the plan; falsifier is Phase 3 side-by-side comparison.
C	Constraint		4	4	strong	Phase sizing MUST reflect agent-runtime cadence, not human-team cadence	Initial draft of the migration plan framed phases in days and weeks (Phase 1 "half a day"; Phase 2 "2-3 days"; Phase 3 "1 day to wire, two weeks elapsed"; Phase 5 "after one week of green audits"; total "~3-4 weeks elapsed, ~5 engineering days"). Operator caught this: "How does timing take a week to do this?!" The framing was a human-team migration playbook applied to an agent-runtime context where the actual bottleneck is operator review attention between phases, not engineering hours. Corrected via amendment commit dde7c50b: Phase 1 ~1 hour, Phase 2 ~2-3 hours, Phase 3 ~1 hour wiring + 2-3 real PRs operator-paced, Phases 4-5 minutes each. Total: an afternoon of agent-runtime sessions plus real-PR cadence for the side-by-side check. Constraint applies generally: any future migration plan MUST account for who/what is doing the work. Agent-runtime tooling sessions are hours; human-team migrations are days; both are valid models for different contexts. The mismatch is the failure mode.
L	Learning		4	4	strong	Skipped oddkit gauntlet on Move D entirely; operator caught it post-merge	Move D (migration plan authoring) went from draft to PR open without oddkit_challenge, oddkit_encode, or oddkit_validate calls. Operator caught the missing gauntlet after PR #77 had merged: "Sorry, did we run the gauntlet on the plan?" Pattern observed: routine-feeling work is the highest-risk drift mode for discipline skipping because the discipline feels skippable when the work is "obvious." Mitigation forward: any task producing a PR-targeted artifact runs the gauntlet, regardless of perceived routine-ness. The gauntlet's value lies precisely in catching issues the author already feels confident about — exactly the case where confidence is least reliable. Same lesson surfaced previously in this session: the 5962-word PR #198 calibration failure was also a case of process discipline not catching a bloat issue until operator intervention. The pattern is that operator-as-validator catches drift the agent-as-author-and-self-reviewer does not; verification requires fresh context.
O	Observation		4	4	strong	Canon doc literally names the AMS audit gate as cleanest first impl of the runtime	klappy://canon/methods/persona-shaped-agent-runtime §First Worked Examples §The Audit Gate explicitly states: "The audit gate that currently runs against AMS PRs is the cleanest validator-role consumer in isolation. It exercises the validator role's enforcement (read-only tools, fresh-context guarantee, structured deliverable per P0008) without needing the full multi-role pipeline. It is the right first deployment of the runtime because it isolates one role and produces concrete signal on whether validator-role enforcement works in production." The plan did not have to argue for itself; canon endorsed the move days before the plan was written. Working pattern: canon-anticipating-the-impl is what's supposed to happen when canon discipline lands ahead of execution. Reverse pattern (impl forcing canon to retroactively bless an already-shipped choice) is the drift mode canon-first sequencing exists to prevent. This session's C → A → B → D ordering is the worked example of the working pattern.
H	Handoff		5	5	strong	Move D complete; Phase 1 is next with mandatory pre-PR gauntlet	PR #77 merged 02:33 UTC on 2026-05-12. The migration plan is the live target for klappy/agent-messaging-service. Phase 1 is the next move: author canon/personas/ams-canon-code-auditor.md persona profile per klappy://canon/methods/persona-shaped-agent-runtime#the-persona-profile schema. Canon-only PR. ~1 hour estimated. Persona profile fields: persona=ams-canon-code-auditor; version=1; system_prompt_uri=ams://canon/constraints/canon-code-sync-via-spawned-agent-session; role=validator; mcp_servers.operational=[oddkit]; mcp_servers.task_relevant=[]; knowledge_bases=[klappy://, ams://]; surface_profiles.audit={density: medium, structured_output: required, output_schema: ams://canon/constraints/canon-code-sync-via-spawned-agent-session#output-contract}; brand_discipline=null. Lesson carried forward: gauntlet MUST be run pre-PR. The Move D lesson is binding for all subsequent migration phases.
